{
  "id": "harafuhub.outlook",
  "repo": "harafuhub/winshun-outlook",
  "autoUpdate": true,
  "version": "1.4.1",
  "url": "https://github.com/harafuhub/winshun-outlook/releases/download/v1.4.1/harafuhub.outlook-1.4.1.wsplugin",
  "sha256": "603d4a3a9242797c7a1fee910bdcc433244cee305d5d5246785c210421397b04",
  "size": 61766,
  "name": {
    "zh": "Outlook 邮件",
    "en": "Outlook mail"
  },
  "description": {
    "zh": "ol 关键词：通过 Windows 搜索索引查找经典 Outlook 的邮件和附件（PDF、Word、Excel 的内容），Enter 打开",
    "en": "ol <words>: finds classic Outlook mail and its PDF, Word and Excel attachments by content through the Windows Search index; Enter opens"
  },
  "author": "harafuhub",
  "license": "MIT",
  "homepage": "",
  "keywords": [
    "ol",
    "mail"
  ],
  "permissions": [],
  "runtime": {
    "mode": "resident",
    "program": "powershell"
  },
  "minWinShun": "",
  "releaseDate": "2026-10-28T03:47:15Z",
  "dateAdded": "2026-10-28T03:21:23Z"
}
