{
  "id": "winshun.go",
  "repo": "LingCore/WinShun-plugins",
  "autoUpdate": false,
  "bundled": true,
  "version": "1.1.0",
  "url": "https://github.com/LingCore/WinShun-plugins/releases/download/winshun.go-v1.1.0/winshun.go-1.1.0.wsplugin",
  "sha256": "bcfb209b4a7404d84efd9861531e5892eb545cb17c847bd07383a73039599936",
  "size": 5069,
  "name": {
    "zh": "快捷跳转",
    "en": "Go to"
  },
  "description": {
    "zh": "零代码示例：code 用 VS Code 打开、dl 下载文件夹、pdf 找 PDF、go 常用位置",
    "en": "Zero-code sample: code opens in VS Code, dl Downloads, pdf finds PDFs, go common places"
  },
  "author": "LingCore",
  "license": "MIT",
  "homepage": "https://github.com/LingCore/WinShun",
  "keywords": [
    "code",
    "np",
    "dl",
    "desk",
    "pdf",
    "img",
    "go"
  ],
  "permissions": [
    "processes"
  ],
  "runtime": {
    "mode": "zero-code",
    "program": null
  },
  "minWinShun": "",
  "releaseDate": "2026-10-29T05:01:20Z",
  "dateAdded": "2026-10-23T09:12:38Z"
}
